{
  "requestId": "550e8400-e29b-41d4-a716-446655440000",
  "timestamp": "2026-02-06T14:30:01Z",
  "responder": {
    "bic": "PRYBUA2XXXX",
    "nbuId": "300023"
  },
  "result": {
    "matchStatus": "MATCH",
    "matchScore": 100,
    "reasonCode": "ANNM",
    "reasonDescription": "Account name match",
    "verifiedName": "ШЕВЧЕНКО ТАРАС ГРИГОРІЙОВИЧ",
    "accountStatus": "ACTIVE"
  },
  "processingTime": 850
}
