{
  "requestId": "550e8400-e29b-41d4-a716-446655440000",
  "timestamp": "2026-02-06T14:30:01Z",
  "responder": {
    "bic": "PRYBUA2XXXX",
    "nbuId": "300023"
  },
  "result": {
    "matchStatus": "NO_MATCH",
    "matchScore": 35,
    "reasonCode": "ANNM",
    "reasonDescription": "Account name no match - names are significantly different",
    "accountStatus": "ACTIVE"
  },
  "processingTime": 780
}
